{
  "schema_version": "daily-compiler-d1-cloud-proof-execution-v2",
  "proof_id": "d1-six-image-browser-r1",
  "branch": "rehearsal/d1-six-image-browser-r1",
  "status": "BROWSER_RUNNING",
  "request_path": "rehearsals/d1-six-image-browser-r1/request.json",
  "acceptance_manifest_path": null,
  "ingest_mapping_path": "rehearsals/d1-six-image-browser-r1/ingest-mapping.json",
  "ingest_handoff_path": null,
  "work_porter_receipt_path": null,
  "cloud_proof_path": null,
  "native_generations": 4,
  "accepted_assets": [],
  "accepted_story_chats": [],
  "owner_intervention": false,
  "local_computer_used": false,
  "last_error": null,
  "updated_at": "2026-10-07T22:18:04.921796Z"
}
