{
  "schema_version": "daily-compiler-d1-cloud-proof-execution-v2",
  "proof_id": "value-image-profile-v2-2026-10-08",
  "branch": "qualification/value-image-profile-v2-2026-10-08",
  "status": "PLANNED",
  "request_path": "qualifications/value-image-profile-v2-2026-10-08/request.json",
  "acceptance_manifest_path": null,
  "ingest_mapping_path": "qualifications/value-image-profile-v2-2026-10-08/ingest-mapping.json",
  "ingest_handoff_path": null,
  "work_porter_receipt_path": null,
  "cloud_proof_path": null,
  "native_generations": 0,
  "accepted_assets": [],
  "accepted_story_chats": [],
  "owner_intervention": false,
  "local_computer_used": false,
  "last_error": null,
  "updated_at": "2026-10-08T23:51:30.626Z",
  "specification_binding": {
    "request_sha256": "8fcf6822346127a6d23de6aec9e8e7a6123228653ee0c7db87c95cb9bcf821aa",
    "source_evidence_sha256": "34bb46ed8c2c392f52fec5af79ae63fb0cfbd454c6304af1aaca36ebebdeec63",
    "source_commit": "4a304c23d6ab1bdd7b842c059a157889dc4dbfdf",
    "request_commit": "d4eb872f817c0b0f4c3bd59e8a68704458f604aa",
    "source_evidence_path": "qualifications/value-image-profile-v2-2026-10-08/source-evidence.json",
    "attempt_log_sha256": "5e87ffaafc37e25fdd9b35a1f94849eced1e5da918c8f3e63ddab2171336f5bc"
  }
}
